_id,AID,AName,Description,Benefits,Breathing,awareness,Level,ImagePath,Variations
65f08d051bad35f99effc121,180,Eka Pada Sirasana (one foot to head pose),"Sit with the legs outstretched in front of the body. Bend the right knee, turning it slightly out to the side. Bring the right arm under the calf muscle and hold the outside of the leg just above the ankle. Raise the left arm and hold the outside of the right ankle. The right arm should be positioned so that the elbow lies between the thigh and the lower leg. Raise the right leg using the arms and hands. As the leg is raised, bend the trunk foxward and twist slightly to the left. Without straining, place the leg on top of the right shoulder. Release the grip of the right hand. Raise the right leg higher by using the left arm and by pushing the thigh back using the right upper arm. Without straining, try to place the right foot behind the head at the nape of the neck. This is achieved by bending the head foxward under the calf muscle, which then rests on the shoulder. Finally, place the hands in front of the chest at the centre of the sternum. Try to straighten the spine and hold the head upright. This is the final position. 357 Close the eyes and hold the pose for as long as is comfortable. Slowly release the leg and return to the starting position. Repeat on the other side.","This asana compresses each side of the abdomen, thoroughly massaging the internal organs, stimulating peristalsis and removing constipation. It tones the reproductive organs and improves blood circulation in the legs, relieving varicose veins. It increases the level of energy in the chakras, thus vitalizing the body and mind.",: Breathe normally while moving into the pose. Breathe slowly and deeply in the final position.,"Physical - on the stretch in the hip, groin and leg muscles, the compression in the abdomen and the sensations in the spine. Spiritual - on anahata chakra.",Beginners,yoga_images/eka_pada_sirasana_(one_foot_to_head_pose).jpg,
65f08d051bad35f99effc122,181,Utthan Eka Pada Sirasana (standing foot to head pose),"Assume eka pada sirasana with the right leg behind the head. Place both palms on the floor, using the hands and arms for support. Lean back slightly and come into a squatting position on the left leg. Straighten the knee and stand upright. Do not strain. When balance is secured in the standing position, place the palms together in front of the chest. This is the final position. Maintain balance in the standing position for as long as is BSYo comfortable. Carefully sit down and release the raised leg. Stretch the legs fotward and relax. Repeat with the other leg behind the head.",": As for eka pada sirasana. In addition, this asana strengthens the thigh and back muscles, and improves concentration.",Inhale as the body is raised. Breathe normally in the final position. Exhale as the body is lowered,"Physical - on raising the body to the upright position, on normal breathing in the final position, and on maintaining balance. Spiritual- on anahata c",Beginners,yoga_images/utthan_eka_pada_sirasana_(standing_foot_to_head_pose).jpg,
65f08d051bad35f99effc125,184,Padma Parvatasana (lotus mountain pose),"Perform padmasana. Relax the whole body. Firstly, supporting the weight with the hands, stand on the knees. Focus the gaze on a fixed point, lift the hands from the floor and, when balanced, bring the palms of the hands together in front of the chest in the prayer pose. Hold the final position for as long as is comfortable. To release, slowly lower the hands and then the buttocks to the floor and sit in padmasana. Release the legs, change their position and repeat the pose for the same length of time.","In addition to the benefits of padmasana, this asana develops the sense of balance.",: Exhale while initially raising the buttocks. Breathe normally in the final position. Exhale while lowering the body to the floor,Physical - on maintaining balance and on the breath. Spiritual - on swadhisthana chakra,Beginners,yoga_images/padma_parvatasana_(lotus_mountain_pose).jpg,
65f08d051bad35f99effc126,185,Kashyapasana (Sage Kashyapa's pose),"Assume santolanasana, variation 1. Bend the left knee and place the foot on the right thigh as in ardha padmasana. Take the left ann behind the back and hold the left foot or big toe with the left hand. The chest and extended right ann should be in one plane. This is the final position. Hold for as long as is comfortable. Release the left foot and return to santolanasana. Repeat on the other side. Practise once on each side and then relax in shashankasana.","This asana strengthens the shoulders, arms and legs and opens the chest. Anahata and manipura chakras are activated, along with samana vayu. A sense of balance and concentration is developed",Normal throughout,"Physical - on the alignment of trunk and limbs, and on maintaining balance. Spiritual - on manipura chakra.",Beginners,yoga_images/kashyapasana_(sage_kashyapa's_pose).jpg,
65f08d051bad35f99effc129,188,SHEETALI PRANAYAMA ,"Sit in any comfortable meditation posture.\nClose the eyes and relax the whole body.\nExtend the tongue outside the mouth as far as possible\nwithout strain.Roll the sides of the tongue up so that it\nforms a tube. Practise a long, smooth and controlled\ninhalation through the rolled tongue.\nAt the end of inhalation, draw the tongue in, close the\nmouth and exhale through the nose.\nPractise yogic breathing throughout.\nThe breath should produce a sucking sound.\nA feeling of icy coldness will be experienced on the tongue\nand the roof of the mouth. This is one round. ","This practice cools the body and affects important\nbrain centres associated with biological drives and temperature regulation. It cools and reduces mental and\nemotional excitation, and encourages the free flow of prana\nthroughout the body. It induces muscular relaxation,\nmental tranquillity and may be used as a tranquillizer\nbefore sleep. It gives control over hunger and thirst, and\ngenerates a feeling of satisfaction",": With practice, the duration of the inhalation should\ngradually become longer to increase the cooling effect.\nGradually increase the number of rounds from 9 to 1 5.\nFor general purposes 15 rounds is sufficient; however, up\nto 60 rounds may be performed in very hot weather. ","On the tongue, the sound and the cooling sensation of the inhaled breath",Beginners,yoga_images/sheetali_pranayama_.jpg,"Sheetali is derived from the root sheet, which means 'cold'.\nSheetal means 'that which is calm, passionless and soothing'. "
65f08d051bad35f99effc131,196,Jnana Mudra (psychic gesture of knowledge),Assume a comfortable meditation posture. Fold the index fingers so that they touch the inside root of the thumbs. Straighten the other three fingers of each hand so that they are relaxed and slightly apart. Place the hands on the knees with the palms facing down. Relax the hands and arms.,"Jnana mudra and chin mudra are simple but important psycho-neural finger locks which make meditation asanas more powerful. The palms and fingers of the hands 425 have many nerve root endings which constantly emit energy. When the index finger touches the thumb, a circuit is produced which allows the energy that would normally dissipate into the environment to travel back through the body and up to the brain. When the fingers and hands are placed on the knees, the knees are sensitized, creating another pranic circuit that maintains and redirects prana within the body. In addition, placing the hands on the knees stimulates a nadi which runs from the knees, up the inside of the thighs and into the perineum. This nadi is known as gupta or the hidden nadi. Sensitizing this channel helps to stimulate the energies at mooladhara chakra. When the palms face upward in chin mudra, the chest area is opened up. The practitioner may experience this as a sense of lightness and receptivity, which is absent in the practice of jnana mudra.",inhale or exhale,focus on the breath,Beginners,yoga_images/jnana_mudra_(psychic_gesture_of_knowledge).jpg,"J nana and chin mudras are often performed with the tip of the thumb and index finger touching and forming a circle. Beginners may find this variation les� secure for prolonged periods of meditation, as the thumb and index finger tend to separate more easily when body awareness is lost. Otherwise, this variation is as effective as the basic position."
65f08d051bad35f99effc133,198,"Yoni mudra may also be performed by interlocking the middle, ring and little fingers without turning them inward. The thumbs may be crossed in front of the outstretched index fingers, or outstretched with the pads touching towards the body.","Assume a comfortable meditation posture with the head\nand spine straight.\nPlace the palms of the hands together with the fingers and\nthumbs straight and pointing away from the body.\nKeeping the pads of the index fingers together, turn the\nlittle, ring and middle fingers inwards so that the backs of\nthe fingers are touching.\nInterlock the little, ring and middle fingers.\nBring the thumbs towards the body and join the pads of\nthe fingers together to form the base of a yoni or womb\nshape. ",": The interlocking of the fingers in this practice creates\na complete cross-connection of energies from the right\nhand into the left and vice versa. As well as balancing the\nenergies in the body, it helps to balance the activities of the\nright and left hemispheres of the brain. Placing the tips of\nthe index fingers and thumbs together further intensifies\nthe flow of prana.\nThis mudra makes the body and mind more stable in\nmeditation and develops greater concentration, awareness\nand internal physical relaxation.\nIt redirects prana back into the body which would othetwise\nbe dispersed through the hands and fingers. The elbows\nnaturally tend to point to the side when performing this\nmudra which helps open up the chest area. ",inhale or exhale,focus on the breath,Beginners,"yoga_images/yoni_mudra_may_also_be_performed_by_interlocking_the_middle,_ring_and_little_fingers_without_turning_them_inward._the_thumbs_may_be_crossed_in_front_of_the_outstretched_index_fingers,_or_outstretched_with_the_pads_touching_towards_the_body..jpg","Yoni mudra may also be performed by interlocking\nthe middle, ring and little fingers without turning them\ninward. The thumbs may be crossed in front of the outstretched index fingers, or outstretched with the pads\ntouching towards the body. "
65f08d051bad35f99effc135,200,Hridaya Mudra (heart gesture) ,"Sit in any comfortable meditation asana with the head and\nspine straight.\nPlace the tips of the index fingers at the root of the thumbs,\nas in chin and jnana mudras, and join the tips of the\nmiddle and ring fingers to the tips of the thumbs. The\nlittle finger remains straight.\nPlace the hands on the knees with the palms facing upward.\nClose the eyes and relax the whole body, keeping it\nmotionless. ",": This mudra diverts the flow of prana from the hands\nto the heart area, improving the vitality of the heart. The\nmiddle and ring fmgers relate directly to nadis connected\nwith the heart, while the thumb closes the pranic circuit\nand acts as an energizer, diverting the flow of prana from\nthe hands to these nadis . . Hridaya mudra is therefore\nbeneficial for the heart. It is very simple and may be used\nsafely and easily, even in acute situations. The heart is the\ncentre of emotion. Hridaya mudra helps to release pentup emotion and unburden the heart. It may be practised\nduring emotional conflict and crisis. ",inhale or exhale,Physical - on the breath in the chest area.\nSpiritual - on anahata chakra.,Beginners,yoga_images/hridaya_mudra_(heart_gesture)_.jpg,: This practice may be performed for up to 30 minutes. 
65f08d051bad35f99effc139,204,Kaki Mudra (the crow's beak) ,"Sit in any comfortable meditation asana with the head and\nspine straight and the hands resting on the knees in either\nchin or jnana mudra.\nClose the eyes and relax the whole body for a few minutes.\nOpen the eyes and perform nasikagra drishti by focusing\nboth eyes on the nosetip.\nTry not to blink the eyes throughout this practice.\nPurse the lips, forming a beak through which air may be\ninhaled.\nThe tongue should be relaxed.\nInhale slowly and deeply through the pursed lips.\nAt the end of inhalation close the lips and exhale slowly\nthrough the nose.\nRepeat the process for 3 to 5 minutes. ","Kaki mudra cools the body and mind and soothes\nmental tensions. In addition to the benefits of nasikagra\ndrishti, the act of pursing the lips in this practice, together\nwith the contact of the indrawn air with the membranes of\nthe mouth, stimulates digestive secretions, aiding the digestive process generally",inhale or exhale,"On the flow and sound of the breath, and on the\nnosetip. ",Beginners,yoga_images/kaki_mudra_(the_crow's_beak)_.jpg,
65f08d051bad35f99effc13a,205,Bhujangini Mudra (cobra respiration) ,"Sit in any comfortable meditation asana.\nClose the eyes and relax the whole body, especially the\nabdomen.\nPush the chin forward and a little upward.\nSuck in air through the mouth and draw it into the stomach,\nnot the lungs, in a series of gulps as though drinking\nwater.\nExpand the stomach as much as possible.\nHold the air inside for as long as comfortable, then expel\nthe air by belching. ","Bhujangini mudra tones the whole stomach, removes\nstagnant wind and helps alleviate abdominal disorders.\nRetaining air in the stomach enables the practitioner to\nfloat in water for any length of time. ",inhale or exhale,focus on the breath,Beginners,yoga_images/bhujangini_mudra_(cobra_respiration)_.jpg,"This practice is similar to the shatkarma, vatsara\ndhauti, and can be used as a cleansing practice. However,\nin vatsara dhauti the air is expelled from the anus rather\nthan by belching. "
65f08d051bad35f99effc13b,206,Bhoochari Mudra (gazing into nothingness) ,"Sit in any comfortable meditation asana with the head and\nspine straight and the hands in chin or jnana mudra.\nClose the eyes and relax the whole body.\nOpen the eyes and raise the right hand in front of the face.\nThe elbow should point to the side of the body.\nHold the hand horizontally, palm down, with the fingers\ntogether.\nThe side of the thumb should be in contact with the top of\nthe upper lip.\nFocus the eyes on the tip of the little finger and gaze at it\nintently for a minute or so, without blinking or flickering\nthe eyes.\nTry to maintain continuous awareness of the little fingertip.\nAfter a minute or so lower the hand. Continue to gaze into\nthe place where the little finger was, without blinking.\nBecome fully engrossed in this point of nothingness.\nSimultaneously, be aware of any thought processes.\nWhen the focus dissipates, raise the hand and again\nconcentrate on the tip of the little finger. After son1e time\n440 \nlower the hand and continue to gaze intently into the\nspace, the nothingness.\nBe aware of space only; there should be no registration of\nouter events in the field of conscious perception.\nContinue the practice for 5 to I 0 minutes.",Bhoochari mudra develops the power of concentration and memory. It tranquillizes and introverts the\nmind and is particularly beneficial for calming anger and\nstress. It develops mental stability and the state of thoughtlessness. It helps to awaken ajna chakra and induce meditative states. It takes the practitioner into the psychic and\nspiritual planes of consciousness. ,inhale or exhale,Physical - on the sensation of complete relaxation\nand stillness.\nSpiritual - on ajna chakra.,Beginners,yoga_images/bhoochari_mudra_(gazing_into_nothingness)_.jpg,"Bhoochari mudra may be performed as a preparation for\nmeditation and as a meditation technique in its own right. It\nbelongs to a group of techniques featuring gazing at an external\nfocal point as a means to achieve dharana or the meditative state\nof relaxed concentration. It is allied to ruzsikagra drishti and\nshambhavi mudras, all three being forms of trataka. "
65f08d051bad35f99effc13c,207,Akashi Mudra (awareness of inner space) ,"Sit in any comfortable meditation asana.\nClose the eyes and relax the whole body for a few minutes.\nFold the tongue back against the palate in khechari mudra.\nPractise ujjayi pranayama and sha1nbhavi mudra.\nBend the head backward about 45 degrees.\nStraighten the arms and lock the elbows, pressing the\nknees with the hands.\nBreathe slowly and deeply in ujjayi.\nContinue for as long as you feel comfortable.\nEnd the practice by bending the elbows and releasing\nkhechari and shambhavi mudras.\nRaise the head to the upright position.\nResume normal breathing and be aware of the inner space. ","This practice combines the benefits of kumbhaka,\nujjayi, shambhavi and khechari. It induces calmness and\ntranquillity, and develops control over the senses. When\nperfected, it arrests the thought processes and induces\nhigher states of consciousness.",inhale or exhale,On ajna chakra. ,Beginners,yoga_images/akashi_mudra_(awareness_of_inner_space)_.jpg,Akashi mudra may also be practised with breath\nretention. Perform the practice as described above. Inhale\nwhile bending the head backwards. Hold the breath inside\nin the final position. Exhale while slowly raising the head\nto the starting position
65f08d051bad35f99effc13e,209,Unmani Mudra (the attitude of mindlessness),"Sit in any comfortable meditation asana.\nOpen the eyes fully, but without straining.\nInhale slowly and deeply. Hold the breath inside. Focus\nthe awareness at hindu in the back of the head for a few\nseconds.\nExhale slowly, allowing the awareness to descend with the\nbreath from hindu through the chakras in the spine: ajna,\nvishuddhi, anahata, manipura, swadhisthana, mooladhara.\nThe eyes should slowly close as the awareness descends. By\nthe time the awareness reaches mooladhara, the eyes should\nbe fully closed.\nEven when the eyes are open, the awareness is looking\nwithin.\nDo not try too hard, but allow the process to occur\nspontaneously.\nInhale deeply and begin the next round.\nContinue for 5 to 10 minutes","Unmani mudra calms stress and agitation, and\ninduces a meditative state. ",inhale or exhale,focus on the breath,Beginners,yoga_images/unmani_mudra_(the_attitude_of_mindlessness).jpg,
65f08d051bad35f99effc141,212,TADAGI MUDRA,"Sit with the legs stretched out in front of the body and the\nfeet slightly apart. The legs should remain straight\nthroughout the practice. Place the hands on the knees,\nkeeping the head and spine straight.\nClose the eyes and relax the whole body, especially the\nabdominal area.\nLean forward and grasp the big toes with the thumbs,\nindex and second fingers. Keep the head facing forward.\nInhale slowly and deeply, expanding the abdominal\nmuscles to their fullest extent.\nRetain the breath inside for a comfortable length of time\nwithout straining the lungs in any way.\nExhale slowly and deeply while relaxing the abdomen.\nMaintain the hold on the the toes.\nRepeat the breathing up to 1 0 times.\nThen release the toes and return to the starting position.\nThis is one round.","Tadagi mudra relieves tension stored in the dia-\nphragm and pelvic floor, tones the abdominal organs and\n\nstimulates blood circulation to these areas. The nerve\nplexuses in the visceral area are stimulated and toned.\nBending fo1ward and extending the stomach stretches the\n\ndiaphragm and pelvic floor, and creates pressure through-\nout the trunk of the body. This stimulates manipura chakra,\n\nthe centre of energy distribution, and raises the level of\nprana generally.",inhale or exhale,Physical - on the abdomen\nSpiritual - on manipura chakra.,Beginners,yoga_images/tadagi_mudra.jpg,
65f08d051bad35f99effc143,214,Yoga Mudra (attitude of psychic union),"Sit in padmasana.\nTake hold of one wrist behind the back.\nClose the eyes and relax the whole body.\nBring the awareness to mooladhara chakra (slight n1oola\nbandha may also be performed.)\nInhale slowly and feel the breath gradually rising from\nmooladhara to ajna chakra. Retain the breath for a few\nseconds and concentrate on ajna chakra.\nExhale slowly while bending forward from the hips.\nSynchronize the movement with the breath, so that the\nforehead just touches the floor in yogamudrasana as the\nair is fully expelled from the lungs.\nSimultaneously, feel the breath gradually descending from\najna to mooladhara chakra.\nRetain the breath outside for a few seconds while\nconcentrating at mooladhara chakra.\nInhaling, raise the trunk to the vertical position. Be aware\nof the breath moving upward from mooladhara to ajna\nchakra.\nAll the moven1ents should be performed in a harmonious,\nsmooth and synchronized manner.\nRemain in the upright position, holding the breath for a\nfew seconds and concentrate on ajna chakra.\nExhale slowly, moving the awareness back down the spine\nto mooladhara chakra.\nThis is one round.\n456 \nImmediately start another round, performing a light moola\nbandha with the breath held outside and the awareness at\nmooladhara chakra. Beginners may take a few normal\nbreaths before starting the next round.\nPerform 3 to I 0 rounds. ","The practice massages the abdominal organs and\nstretches the back, contributing to good general health. In\naddition, it is an excellent preparatory practice for meditation, engendering a sense of relaxation. It relieves anger\nand tension, inducing tranquillity. It develops awareness\nand control of psychic energy and is used to awaken\nmanipura chakra",The respiration should be as slow as possible without\nthe slightest strain.,Physical - on synchronizing the movement of the\nbody with the breath.\nSpiritual - on mooladhara and ajna chakras. ,Beginners,yoga_images/yoga_mudra_(attitude_of_psychic_union).jpg,"The hands may also be placed:\na) on the heels of the feet, with the elbows pointing out to\nthe sides,\nb) palms down on the soles of the feet,\nc) palm to palm with the fingers pointing upward in the\nmiddle of the back (this is ham.sa or swan mudra). "
65f08d051bad35f99effc149,220,VAJROLI/SAHAJOLI MUDRA,"Sit in siddha/siddha yoni asana, or any comfortable\nmeditation posture with the head and spine straight.\nPlace the hands on the knees in chin or jnana mudra.\nClose the eyes and relax the whole body.\nTake the awareness to the urethra.\nInhale, hold the breath inside and draw the urethra upward.\nThis action is similar to holding back an intense urge to\nurinate. The testes in men and the labia in women should\nmove slightly upward during this contraction.\nConfine the contraction to the urethra.\nHold the contraction for as long as comfortable, starting\nwith a few seconds, and gradually increasing.\nExhale, releasing the contraction, and relax. "," Vajroli/sahajoli mudra regulates and tones the entire\nuro-genital system. It helps overcome psycho-sexual conflicts and unwanted sexual thoughts. It conserves and\nredirects energy, enhancing meditative states. ","Begin with 3 contractions, Slowly increase to 1 0. ","Physical - on isolating the point of contraction,\navoiding generalized contraction of the pelvic floor.\nSpiritual - on swadhisthana chakra. ",Beginners,yoga_images/vajroli/sahajoli_mudra.jpg,
65f08d051bad35f99effc070,3,Goolf Chakra,"Remain in the base position.\nKeep the legs shoulder-width apart and straight.\nKeep the heels on the ground throughout the practice.\nStage I : Slowly rotate the right foot clockwise from the ankle\n10 times and then repeat 10 times anti-clockwise.\nRepeat the same procedure with the left foot.\nStage 2: Slowly rotate both feet together in the same direction.\nFocus on rotating the feet and not the knees.\nPractise 10 times clockwise and then 10 times anti-clockwise.\nStage 3: Keep the feet separated.\nSlowly rotate both feet from the ankles together, but in\nopposite directions.\nDo 10 rotations in one direction and then 10 rotations in\nthe opposite direction.","This group of asanas is concerned with loosening up the joints\nof the body. It is excellent for those debilitated by rheumatism,\n\narthritis, high blood pressure, heart problems or other ail-\nments where vigorous physical exercise is not advised. It is\n\nparticularly useful for eliminating energy blockages in the\njoints of the physical body, and for improving coordination,\nself-awareness and self-confidence.",Inhale on the upward movement.\nExhale on the downward movement.,On the rotation of the ankle and the breath.,Beginners,yoga_images/goolf_chakra.jpg,
65f08d051bad35f99effc072,5,Janufalak Akarshan,"Stay in the base position.\nGently contract the muscle surrounding the right knee,\ndrawing the kneecap back towards the thigh.\nHold the contraction for 3 to 5 seconds, counting mentally.\nRelease the contraction and let the kneecap return to its\nnormal position.\nPractise 10 times. Repeat with the left kneecap 10 times,\nthen with both kneecaps together.","This group of asanas is concerned with loosening up the joints\nof the body. It is excellent for those debilitated by rheumatism,\n\narthritis, high blood pressure, heart problems or other ail-\nments where vigorous physical exercise is not advised. It is\n\nparticularly useful for eliminating energy blockages in the\njoints of the physical body, and for improving coordination,\nself-awareness and self-confidence.",Inhale while contracting.\nExhale while relaxing the knee muscles.,On the contraction and the breath.,Beginners,yoga_images/janufalak_akarshan.jpg,
