_id,AID,AName,Description,Benefits,Breathing,awareness,Level,ImagePath,Variations
65f08d051bad35f99effc084,23,Supta Udarakarshanasana,"Lie in the starting position and relax. Bend the knees and place the soles of both fe et flat on the floor, directly in front of the buttocks. Keep the knees and fe et together throughout the practice. Interlock the fingers of both hands, place the palms under the back of the head and let the elbows touch the floor. Breathe in, and while breathing out, slowly lower the legs to  the right, trying to bring the knees down to the floor. The fe et should remain in contact with each other, although the left fo ot will  move slightly off the  floor. At the same time, gently turn the head and neck in  the  opposite direction to  the  legs.  This  will  give  a uniform twisting stretch to  the entire spine. Hold the breath in the final position while mentally counting three seconds. While breathing in, raise both legs to the upright position. Keep the shoulders and elbows on the floor throughout. Repeat on the left side to complete one round. Practise 5 complete rounds. ","This asana gives an excellent stretch to the abdominal muscles and organs, and thereby helps to improve diges­tion and eliminate constipation. The twisting stretch of the spinal muscles relieves the strain and stiffness caused by prolonged sitting. The distance of the feet from the buttocks determines the placement of the spinal twist. If the feet are about 60 em from the buttocks, the adjustment is in the lower area of the spine. As the feet approach the buttocks, the adjustment rises up the spine. When the feet are next to the buttocks, the adjustment is in the area of the cardiac plexus. Ther­efore, moving the feet about 3 em each time works on each vertebra, bringing suppleness to the whole spinal column.",Exhale while lowering the legs to the sides. Hold the breath in the final position. Inhale while raising the legs.,"On the twisting stretch of the paraspinal and abdominal muscles, and the breath,",Beginners,yoga_images/supta_udarakarshanasana.jpg,"Bend the knees and bring the thighs up to the chest. Interlock the fingers and place them behind the head. Roll the body from side to side, keeping the elbows on the floor."
65f08d051bad35f99effc08a,29,Nauka Sanchalanasana,"Sit with both legs straight in front of the body. Imagine the action of rowing a boat. Clench the hands as though grasping oars, with the pahns facing down. Breathe out and bend forward from the waist as far as is comfortable, straightening the arms. Breathing in, lean back as fa r as possible, drawing the hands back towards the shoulders. This is one round. The hands should make a complete circular movement in every round, moving up the sides of the legs and trunk. The legs should be kept straight throughout. Practise 5 to 1 0 rounds. Reverse the direction of the rowing movement as though going in the opposite direction. Practise 5 to 1 0 times.",This asana has a positive effect on the pelvis and abdomen and releases energy blockages in these areas. It is especially useful for gynaecological disorders and post­natal recovery. It also removes constipation.,Inhale while leaning back. Exhale while bending fo rward.,"On the movement and sensations in the lower back, hips and pelvic area, and the breath.",Beginners,yoga_images/nauka_sanchalanasana.jpg,
65f08d051bad35f99effc090,35,Palming (Eye Exercise),"Sit quietly and close the eyes. Rub the paln1s of the hands together vigorously until they become warm. Place the palms gently over the eyelids, without any undue pressure. Feel the warmth and energy being transmitted from the hands into the eyes and the eye muscles relaxing. The eyes are being bathed in a soothing darkness. Remain in this position until the heat from the hands has been absorbed by the eyes. Then lower the hands, keeping the eyes closed. Again rub the palms together until they become hot and place them over the closed eyes. (Make sure the palms and not the fingers cover the eyes.) Repeat this procedure at least 3 times.","Palming relaxes and revitalizes the eye muscles, and stimulates the circulation of the aqueous humour, the liquid that runs between the cornea and the lens of the eye, aiding the correction of defective vision.",inhale or exhale,focus on the breath,Beginners,yoga_images/palming_(eye_exercise).jpg,"The benefits are enhanced if the exercise is practised in front of the rising or setting sun. Be aware of the warmth and light on the closed lids. Never look directly at the sun, except for a few initial moments when it is just rising or when it is about to set."
65f08d051bad35f99effc091,36,Blinking (Eye Exercise) ,Sit with the eyes open. Blink the eyes 10 times quickly. Close the eyes and relax for 5 or 6 relaxed breaths. Repeat the blinking 1 0 times quickly and then again close the eyes and relax. Repeat 5 times.,"Many people with defective eyesight blink irregularly and unnaturally. This is related to the state of habitual tension in the eyes. This exercise encourages the blinking reflex to becmne spontaneous, inducing relaxation of the eye muscles.",inhale or exhale,focus on the breath,Beginners,yoga_images/blinking_(eye_exercise)_.jpg,
65f08d051bad35f99effc095,40,Rotational Viewing (Eye Viewing),"Maintain the same body position as in exercise 5. Place the right hand on the right knee. Hold the left fist above the left leg with the left thumb pointing upward and the elbow straight. Make a large circular movement with the left arm to the left, then upward, curving to the right, and finally returning to the starting position. Keep the eyes focused on the thumb without moving the head. Perform 10 times clockwise and then 10 times anticlockwise. Repeat with the right thumb. Keep the head and spine straight throughout. Finally, close and rest the eyes. Palming may be performed several times.",Rotational viewing improves the coordinated activities of all the eye muscles.,Inhale while completing the upper arc of the circle. Exhale while completing the lower arc. The breath should be smooth and synchronized with the forming of a perfect circle.,focus on the breath,Beginners,yoga_images/rotational_viewing_(eye_viewing).jpg,
65f08d051bad35f99effc098,43,Shavasana (corpse pose),"Lie flat on the back with the arms about 15 em away from the body, palms facing upward. A thin pillow or folded cloth may be placed behind the head to prevent discomfort. Let the fingers curl up slightly. Move the feet slightly apart to a comfortable position and close the eyes. The head and spine should be in a straight line. Make sure the head does not fall to one side or the other. Relax the whole body and stop all physical movement. Become aware of the natural breath and allow it to become rhythmic and relaxed. Mter some time, again become aware of the body and surroundings, and gently and smoothly release the posture.","This asana relaxes the whole psycho-physiological system. It should ideally be practised before sleep; before, during and after asana practice, particularly after dynamic exercises such as surya namaskara; and when the practitioner feels physically and mentally tired. It develops body awareness. When the body is completely relaxed, awareness of the mind increases, developing pratyahara.","Natural and relaxed, or begin to count the breaths from number 27 backwards to zero. Mentally repeat, ""I am breathing in 27, I am breathing out 27, I am breathing in 26, I am breathing out 26"", and so on, back to zero. If the mind wanders and the next number is forgotten, bring it back to the counting and start again at 27. If the mind can be kept on the breath for a few minutes, the body will relax.","Physical - first on relaxing the whole body, then on the breath. Spiritual - on ajna chakra. Do not move the body at all during the practice \nas even the slightest movement disturbs the practice. \nA personal mantra may be repeated with every inhalation \nand exhalation. \nFor maximum benefit, this technique should be performed \nafter a hard day's work, before evening activities, or to \nrefresh the body and mind before sitting for meditation, \nor just before sleep.",Beginners,yoga_images/shavasana_(corpse_pose).jpg,
65f08d051bad35f99effc0a0,51,Siddhasana (accomplished pose for men),"Sit with the legs straight in front of the body. Bend the right leg and place the sole of the foot flat against the inner left thigh with the heel pressing the perineum (the area midway between the genitals and anus). Bend the left leg. Push the toes and the outer edge of the left foot into the space between the right calf and thigh muscles. If necessary, this space may be enlarged slightly by using the hands or temporarily adjusting the position of the right leg. Place the left ankle directly over the right ankle so that the ankle bones are touching and the heels are one above the other. Press the pubis with the left heel directly above the genitals. The genitals will therefore lie between the two heels. If this last position is too difficult, simply place the left heel as near as possible to the pubis. Grasp the right toes and pull them up into the space between the left calf and thigh. Again adjust the body so that it is comfortable. Sit on top of the right heel. This is an important aspect of 100 siddhasana. Adjust the body until it is comfortable and the pressure of the heel is firmly applied. The legs should now be locked, with the knees touching the ground and the left heel directly above the right heel. Make the spine erect and feel as though the body is fixed on the floor. Place the hands on the knees in jnana, chin or chinmaya mudra. Close the eyes and relax the whole body. Siddhasana may be performed with either leg \nuppermost. Many people experience discomfort due to \nthe pressure applied where the ankles cross each other. If \nnecessary, place a folded cloth or piece of sponge between \nthe legs at this point. At first the pressure at the perineum \nmay be uncomfortable to maintain, but with practice this \nwill be eased.","Siddhasana directs the energy from the lower psychic centres upward through the spine, stimulating the brain and calming the entire nervous system. The position of the lower foot at the perineum presses mooladhara chakra, stimulating moola bandha, and the pressure applied to the pubic bone presses the trigger point for swadhisthana, automatically activating vajroli/sahajoli mudra. These two psycho-muscular locks redirect sexual nervous impulses back up the spinal cord to the brain, establishing control over the reproductive hormones which is necessary in order to maintain brahmacharya for spiritual purposes. Prolonged periods in siddhasana result in noticeable tingling sensations in the mooladhara region, which may last for ten to fifteen minutes. This is caused by a reduction in the blood supply to the area and by a rebalancing of the pranic flow in the lower chakras. This posture redirects blood circulation to the lower spine and abdomen, toning the lumbar region of the spine, the pelvis and the abdominal organs, and balancing the reproductive system and the blood pressure.",inhale or exhale,focus on the breath,Beginners,yoga_images/siddhasana_(accomplished_pose_for_men).jpg,
65f08d051bad35f99effc0a3,54,Dhyana Veerasana (hero's meditation pose),"Sit with both legs straight in front of the body. Bend the left leg underneath the right leg so that the left heel is touching the right buttock. Bring the right leg over the top of the bent left leg so that the right heel touches the left buttock. Adjust the right knee so that it is above the left knee. Place the hands either on the right knee, one on top of the other, or on top of each foot, whichever is comfortable. Hold the head, neck and back straight. Close the eyes and relax the whole body. Be aware of the breath at the nosetip.","This asana is quite easy and comfortable to sustain for long periods of time as a comparatively large area of the body is in contact with the floor. It is a useful alternative to other meditation asanas. The legs and hips are not rotated outwards as in the other meditation postures, rather the knees are brought to the centre. This affects the pelvic structure and stretches the outer rather than the inner muscles of the thigh. This position also massages and tones the pelvic and reproductive organs.",inhale or exhale,focus on the breath,Beginners,yoga_images/dhyana_veerasana_(hero's_meditation_pose).jpg,
65f08d051bad35f99effc0a4,55,VAJRASANA,"Kneel on the floor with the knees close together.\nBring the big toes together and separate the heels.\nLower the buttocks onto the inside surface of the feet with\nthe heels touching the sides of the hips.\nPlace the hands on the knees, palms down.\nThe back and head should be straight but not tense.\nAvoid excessive backward arching of the spine.\nClose the eyes, relax the arms and the whole body.\nBreathe normally and fix the attention on the flow of air\npassing in and out of the nostrils.","Vajrasana alters the flow of blood and nervous impulses in the pelvic region and strengthens the pelvic\nmuscles. It is a preventative measure against hernia and\nalso helps to relieve piles. It reduces the blood flow to the\ngenitals and massages the nerve fibres which feed them,\nmaking it useful in dilated veins of the testicles and\nhydrocele in men. It alleviates menstrual disorders. It\nincreases the efficiency of the entire digestive system,\nrelieving stomach ailments such as hyperacidity and peptic\nulcer.",inhale or exhale,"Physical - on the sensations in the legs, buttocks\nand spine. When comfortable in the asana become aware\nof the normal breathing process. This will bring tranquillity\nto the mind if practised with the eyes closed.\nSpiritual - on manipura chakra",Beginners,yoga_images/vajrasana.jpg,"Vajrasana is used by Muslims and Zen Buddhists as a position\nfor prayer and meditation. People who cannot perform padmasana\nor siddlwsana, or find them uncomforlable, may sit in vajrasana\nfor meditation practice."
65f08d051bad35f99effc0a5,56,ANANDA MADIRASANA,"Sit in vajrasana\nPlace the palms on top of the heels so that the fingers are\npointing towards each other. If this is uncomfortable, place\nthe palms just above the heels.\nKeep the head and spine erect, close the eyes and relax the\nwhole body.\nFix the attention at bhrumadhya, the eyebrow centre.","This asana is used primarily to awaken ajna chakra.\nIt also calms the mind, relaxes the nervous system and\ngives all the benefits of vajrasana. ",Slow and deep. Imagine that the breath is moving\nin and out of the eyebrow centre. Inhale from the eyebrow\ncentre to ajna chakra and exhale from ajna to the eyebrow\ncentre. ,"Physical - in the early stages of the practice, awareness should be on the physical sensation, then on the\nbreathing process. When sufficient relaxation has been\nachieved, awareness may be transferred to the eyebrow\ncentre.\nSpiritual - on ajna chakra. ",Beginners,yoga_images/ananda_madirasana.jpg,Ananda madirasana may be peiformed as an alternative to\nclassical meditation postures. \n
65f08d051bad35f99effc0ab,62,MARJARI-ASANA ,"Sit in vajrasana.\nRaise the buttocks and stand on the knees.\nLean fotward and place the hands flat on the floor beneath\nthe shoulders with the fingers facing fotward.\nThe hands should be in line with the knees; the arms and\nthighs should be perpendicular to the floor.\nThe knees may be slightly separated so that they are well\naligned under the hips.\nThis is the starting position.\nInhale while raising the head and depressing the spine so\nthat the back becomes concave.\nExpand the abdomen fully and fill the lungs with the\nmaximum amount of air. Hold the breath for 3 seconds.\nExhale while lowering the head and stretching the spine\nupward. At the end of exhalation, contract the abdomen and pull\nin the buttocks.\nThe head will now be between the arms, facing the thighs.\nHold the breath for 3 seconds, accentuating the arch of\nthe spine and the abdominal contraction.\nThis is one round. ","This asana improves the flexibility of the neck,\nshoulders and spine. It gently tones the female reproductive system, giving relief from menstrual cramps and\nleucorrhea. It may be safely practised during pregnancy;\nforceful contraction of the abdomen, however, should be\navoided. ",Perform the movement breathing as slowly as is\ncomfortable. Aim at taking at least 5 seconds for both\ninhalation and exhalation. ,": Physical - on the flexion of the spine from top to\nbottom, and on the breath synchronized with the\nmovement.\nSpiritual - on swadhisthana chakra",Beginners,yoga_images/marjari-asana_.jpg,
65f08d051bad35f99effc0ae,65,SHASHANK BHUJANGASANA,"Assume the starting position for marjari-asana.\nLower the buttocks onto the heels, moving into shashankasana with the arms outstretched in front of the\nshoulders.\nThen, to come into bhujangasana without moving the\nposition of the hands, slowly move the chest forward, sliding it just above the floor until it is in line with the\nhands. Move the chest further forward and then upward,\nas the arms straighten, and lower the pelvis to the floor.\nIdeally, the nose and chest should just brush the surface of\nthe floor as the body moves forward like the movement of\na snake. Do not strain to achieve this.\nIn the final position, the arms should be straight, the back\narched and the head raised as in bhujangasana, even if\nthe navel does not touch the floor.\nHold this position for a few seconds.\nSlowly raise the buttocks and move backwards, keeping\nthe arms straight, returning to shashankasana.\nThis is one round.\nRelax the whole body for a short time before starting\nanother round.\nPractise 5 to 7 rounds. ","Shashank bhujangasana gives similar benefits to\nbhujangasana and shashankasana. However, the benefits\nof the latter postures come from maintaining the final\nposition, whereas shashank bhujangasana acts mainly by\nalternately flexing the spine backward and forward.\nThis asana gently tones the male and female reproductive\norgans, alleviates menstrual disorders and is an excellent\npost-natal asana, strengthening and tightening the abdominal and pelvic region. It tones and improves the\nfunctioning of the liver, kidneys and other visceral organs.\nIt also stregthens the back muscles",Inhale on the forward movement.\nHold the breath for a few seconds in the final position.\nExhale while returning to shashankasana. ,"Physical - on the flexibility of the spine :and the\nsensation in the arms, shoulders, chest and abdomen; on\nsynchronizing the movement with the breath.\nSpiritual - on swadhisthana chakra. ",Beginners,yoga_images/shashank_bhujangasana.jpg,
65f08d051bad35f99effc0b0,67,Ashwa Sanchalanasana (equestrian pose),"Sit in vajrasana.\nStand up on the knees with the knees and ankles slightly\napart and the arms by the sides.\nStarting with the right side, take a big step fotward, placing\nthe right foot firmly on the floor so that the thigh is\nhorizontal and the ankle is before or directly under the\nknee.\nThis is the starting position. Centre yourself and inhale\ndeeply.\nExhale and lunge fotward smoothly, transferring the body\nweight onto the right foot.\nThe left leg becomes stretched back fully as the trunk\ncomes forward, with the back straight.\nDo not strain. Depending on flexibility, the fingertips or\npalms may touch the floor, or bend fotward slightly so that\nthe fingertips reach the floor.\nIn the final posture, the right foot, both hands, left knee\nand toes support the body. The back is slightly arched and\nthe head faces fotward.\nTo release the posture, inhale and roll the body weigThis is one round. Continue with the forward and backward\nlunges on this side.\nAfter practising on one side, again stand on both knees,\nreturn to vajrasana and relax.\nStand on both knees, take a big step forward with the left\nfoot into the starting position and practise an equal number\nof rounds on this side.\nPractise up to 10 rounds on each side. ht\nback smoothly, centering in the starting position. ","This asana tones the abdominal organs and gives a\ngood stretch to the lower back. It strengthens the hips,\nlegs, ankles and feet, and induces balance in the nervous\nsystem. ",Breathe normally in vajrasana and while coming\ninto the starting position.\nInhale deeply in the starting position.\nExhale while moving forward into the posture.\nHold the breath for a few seconds while feeling the balance.\nInhale while returning to the starting position.\nBreathe normally returning to vajrasana ,"Physical - on the back, thigh muscles, knees,\nankles and Achilles tendons; on the balance and synchronizing the movement with the breath.\nSpiritual - on swadhisthana chakra.",Beginners,yoga_images/ashwa_sanchalanasana_(equestrian_pose).jpg,
65f08d051bad35f99effc0b2,69,Ushtrasana (camel pose),"Sit in vajrasana.\nUSHTRASANA\nStand on the knees with the arms at the sides.\nThe knees and feet should be together, but may be\nseparated if this is more comfortable.\nLean backward, slowly reaching for the right heel with the\nright hand and then the left heel with the left hand.\nDo not strain.\nPush the hips forward, keeping the thighs vertical, and\nbend the head and spine backward as far as is comfortable.\nRelax the whole body, especially the back muscles, into the\nstretch.\nThe weight of the body should be evenly supported by the\nlegs and arms.\nThe arms should anchor the shoulders to maintain the\narch of the back.\nRemain in the final position for as long as is comfortable.\nReturn to the starting position by slowly releasing the\nhands from the heels one at a time. ","This asana is beneficial for the digestive and reproductive systems. It stretches the stomach and intestines,\nalleviating constipation. The backward bend loosens up\nthe vertebrae and stimulates the spinal nerves, relieving\nbackache, rounded back and drooping shoulders. The\nposture is improved. The front of the neck is fully stretched, toning the organs in this region and regulating the\nthyroid gland. It is helpful for people suffering from\nasthma. ",Normal. Do not try to breathe deeply because the\nchest is already stretched.,"Physical - on the abdomen, throat, spine or\nnatural breathing.\nSpiritual - on swadhisthana or vishuddhi chakra",Beginners,yoga_images/ushtrasana_(camel_pose).jpg,"Variation I: To begin with this asana may be practised with\nthe balls of the feet on the floor.\nVariation 2: To accentuate the asana, the right heel may be\ngrasped with the left hand and the left heel with the right\nhand. "
65f08d051bad35f99effc0b3,70,SUPTA VAJRASANA,"Sit in vajrasana. Slowly bend back, taking the support of\nfirst the right elbow and arm and then the left.\nBring the top of the head to the ground, arching the back.\nFind the balance in this position, then place the hands on\nthe thighs.\nTry to keep the knees in contact with the floor. If necessary,\nseparate the knees. Care should be taken not to strain the\nmuscles and ligaments of the thighs and knees by forcing\nthe knees to touch the ground in the fmal position.\nClose the eyes and relax the body.\nBreathe deeply and slowly in the final position.\nReturn to the starting position by breathing in and taking\nthe support of the elbows and arms to return to vajrasana. ","This asana massages the abdominal organs, alleviating digestive ailments and constipation. It tones the spinal\nnerves, n1akes the back flexible and realigns rounded\nshoulders. The nerves in the neck and the thyroid gland\nare particularly influenced. The chest is stretched and\nexpanded to full capacity, filling the lungs and bringing\nmore oxygen into the system. It is beneficial for those\nsuffering fi·om asthma, bronchitis and other lung ailments.\nIt loosens up the legs in preparation for sitting in meditation asanas. It redirects sexual energy to the brain for\nspiritual purposes. ",Deep and slow.,"Physical - on the crown of the head, neck, lower\nback, abdomen or breath.\nSpiritual - on swadhisthana, anahata or vishuddhi chakra. ",Beginners,yoga_images/supta_vajrasana.jpg,"Variation: The back of the head, instead of the top, is placed\non the floor in the final position.\nJoin the hands together and place them under the back of\nthe head, or fold the arms comfortably above the head.\nTry to keep the knees on the floor.\nClose the eyes and relax the whole body. "
